{
  "wave_scope_schema_version": "p13_wave_scope.v1",
  "declared_paths": [
    ".github/workflows/p13-ruler.yml",
    "Makefile",
    "compression-roadmap.md",
    "calendar-pilot-p12/Makefile",
    "calendar-pilot-p12/README.md",
    "calendar-pilot-p12/configs/p13_instrument_artifacts.json",
    "calendar-pilot-p12/contracts/**",
    "calendar-pilot-p12/evals/architecture/**",
    "calendar-pilot-p12/experiments/templates/experiment_record_v2.template.json",
    "calendar-pilot-p12/experiments/waves/p13-wave-harness-v3.scope.json",
    "calendar-pilot-p12/scripts/make_experiment_record.py",
    "calendar-pilot-p12/scripts/make_reward_head_report.py",
    "calendar-pilot-p12/scripts/promote_policy.py",
    "calendar-pilot-p12/scripts/run_p13_wave_gate.py",
    "calendar-pilot-p12/tests/**"
  ],
  "declared": {
    "actions": ["*"],
    "backends": ["*"],
    "surfaces": [
      "app_access",
      "architecture_docs",
      "configuration",
      "contracts",
      "docs",
      "evaluation",
      "experiment_record",
      "ruler_scripts",
      "tests",
      "workspace_access"
    ],
    "instruments": [
      "access_point_docs",
      "architecture_eval",
      "architecture_spec",
      "configuration",
      "contract_schemas",
      "experiment_record",
      "release_and_wave_ruler",
      "root_ci",
      "tests",
      "wave_gate"
    ],
    "control_planes": ["effect_tcb", "evaluator", "optimizer"]
  },
  "required_scenarios": [
    "preservation.action_reward",
    "preservation.authority_belief_denial",
    "preservation.expired_authority",
    "preservation.explanation_trace",
    "preservation.frontier_normal",
    "preservation.frontier_timeout",
    "preservation.missing_belief_evidence",
    "preservation.provider_commit",
    "preservation.provider_conflict",
    "preservation.provider_rollback",
    "preservation.restart_restore",
    "target.binding_manifest_affectedness",
    "target.binding_manifest_protected_path_rejection",
    "target.binding_manifest_signature",
    "target.instrument_mutation_rejection",
    "target.promotion_override_rejection"
  ],
  "old_producer": null,
  "new_producer": null,
  "live_legs": []
}
