{
  "wave_scope_schema_version": "p13_wave_scope.v1",
  "declared_paths": [
    "calendar-pilot-p12/experiments/waves/p13-create-prep-block-deterministic-sandbox.scope.json",
    "calendar-pilot-p12/src/calendar_pilot/effect_kernel/**",
    "calendar-pilot-p12/tests/test_p13_deterministic_sandbox.py"
  ],
  "declared": {
    "actions": [
      "create_prep_block"
    ],
    "backends": [
      "deterministic_sandbox"
    ],
    "surfaces": [
      "authority_gate",
      "effect_gateway",
      "provider",
      "tests",
      "wave_scope"
    ],
    "instruments": [
      "binding_manifest",
      "tests"
    ],
    "control_planes": [
      "effect_tcb",
      "evaluator"
    ]
  },
  "required_scenarios": [
    "preservation.action_reward",
    "preservation.authority_belief_denial",
    "preservation.expired_authority",
    "preservation.explanation_trace",
    "preservation.frontier_normal",
    "preservation.frontier_timeout",
    "preservation.missing_belief_evidence",
    "preservation.provider_commit",
    "preservation.provider_conflict",
    "preservation.provider_rollback",
    "preservation.restart_restore",
    "target.cited_read_side_cutover",
    "target.cited_required_projection",
    "target.compensation_conflict_hold",
    "target.compensation_ticket_binding",
    "target.crash_after_claim",
    "target.crash_after_dispatch",
    "target.crash_before_claim",
    "target.duplicate_delivery",
    "target.effect_ticket_binding",
    "target.no_learning_effect_path",
    "target.product_core_no_effect_reachability",
    "target.reducer_determinism",
    "target.restart_reconciliation",
    "target.revoke_claim_race",
    "target.ticket_single_claim",
    "target.trusted_ingress_forgery",
    "target.verify_ambiguity_reconcile"
  ],
  "old_producer": {
    "cvar": {
      "producer_id": "cvar.before.current",
      "command": [
        "python3",
        "scripts/produce_cvar_frontier.py",
        "--role",
        "before",
        "--current",
        "experiments/promoted/CURRENT.json"
      ]
    },
    "b_migrate": {
      "producer_id": "b_migrate.old.incumbent_deterministic.create_prep_block",
      "command": [
        "python3",
        "scripts/produce_b_migrate_p13_3_old.py"
      ],
      "assertion_set": {
        "path": "experiments/configs/b_migrate_create_prep_block_p13_3.json",
        "sha256": "b8275fc425609a359508924b570e645c467ef5215060e79231584b5371309636"
      }
    }
  },
  "new_producer": {
    "cvar": {
      "producer_id": "cvar.after.current",
      "command": [
        "python3",
        "scripts/produce_cvar_frontier.py",
        "--role",
        "after",
        "--current",
        "experiments/promoted/CURRENT.json"
      ]
    },
    "b_migrate": {
      "producer_id": "b_migrate.new.effect_kernel_sandbox.create_prep_block",
      "command": [
        "python3",
        "scripts/produce_b_migrate_p13_3_new.py"
      ],
      "assertion_set": {
        "path": "experiments/configs/b_migrate_create_prep_block_p13_3.json",
        "sha256": "b8275fc425609a359508924b570e645c467ef5215060e79231584b5371309636"
      }
    }
  },
  "live_legs": [
    {
      "leg": "live-codex-e2e",
      "status": "root-listed",
      "reason": {
        "basis": "unaffected",
        "detail": "P13.3 consumes the frozen ProductCore preview and does not modify the Codex respondent, context, or live access point."
      },
      "artifact": {"path": "P12-RECORD.md", "sha256": "8120270a7e5e5f3d29afb9c7a1b7342593b3707d6dc1025d6b5a3aae17badd3f"},
      "owner": "single-owner development",
      "sign_off": "owner-frozen scope; live Codex unaffected",
      "affected_by_wave": false,
      "expires_at": "2026-08-09T23:59:59Z",
      "next_unblock_action": "Run live-codex-e2e before any wave changes the Codex respondent or live path."
    },
    {
      "leg": "live-diffusiongemma-e2e",
      "status": "root-listed",
      "reason": {
        "basis": "unaffected",
        "detail": "P13.3 does not modify DiffusionGemma, NIM normalization, frontier scoring, or candidate generation."
      },
      "artifact": {"path": "P12-RECORD.md", "sha256": "8120270a7e5e5f3d29afb9c7a1b7342593b3707d6dc1025d6b5a3aae17badd3f"},
      "owner": "single-owner development",
      "sign_off": "owner-frozen scope; live NIM unaffected",
      "affected_by_wave": false,
      "expires_at": "2026-08-09T23:59:59Z",
      "next_unblock_action": "Run live-diffusiongemma-e2e before any wave changes the NIM respondent or frontier."
    },
    {
      "leg": "live-eventkit-e2e",
      "status": "root-listed",
      "reason": {
        "basis": "unaffected",
        "detail": "P13.3 is capability-confined to a no-credential deterministic adapter and does not import, select, or mutate EventKit; P13.4 remains externally blocked."
      },
      "artifact": {"path": "P12-RECORD.md", "sha256": "8120270a7e5e5f3d29afb9c7a1b7342593b3707d6dc1025d6b5a3aae17badd3f"},
      "owner": "single-owner development",
      "sign_off": "owner-frozen scope; EventKit structurally unreachable",
      "affected_by_wave": false,
      "expires_at": "2026-08-09T23:59:59Z",
      "next_unblock_action": "Provision the external §8.5.1 boundary before P13.4 or any EventKit effect handoff."
    }
  ]
}
