{
  "wave_scope_schema_version": "p13_wave_scope.v1",
  "declared_paths": [
    "calendar-pilot-p12/experiments/waves/p13-dogfood-browser-submit-ack.scope.json",
    "calendar-pilot-p12/scripts/browser_dogfood_d1.mjs",
    "calendar-pilot-p12/tests/test_dogfood_d1_capture.py",
    "p13-dogfood.md"
  ],
  "declared": {
    "actions": [],
    "backends": [],
    "surfaces": [
      "browser",
      "docs",
      "ruler_scripts",
      "tests",
      "wave_scope"
    ],
    "instruments": [
      "dogfood_browser_capture",
      "tests"
    ],
    "control_planes": [
      "evaluator"
    ]
  },
  "required_scenarios": [
    "preservation.action_reward",
    "preservation.authority_belief_denial",
    "preservation.expired_authority",
    "preservation.explanation_trace",
    "preservation.frontier_normal",
    "preservation.frontier_timeout",
    "preservation.missing_belief_evidence",
    "preservation.provider_commit",
    "preservation.provider_conflict",
    "preservation.provider_rollback",
    "preservation.restart_restore",
    "target.binding_manifest_affectedness",
    "target.binding_manifest_signature",
    "target.cited_required_projection",
    "target.product_core_no_effect_reachability",
    "target.reducer_determinism"
  ],
  "old_producer": null,
  "new_producer": null,
  "live_legs": []
}
