{
  "wave_scope_schema_version": "p13_wave_scope.v1",
  "declared_paths": [
    "compression-roadmap.md",
    "calendar-pilot-p12/README.md",
    "calendar-pilot-p12/experiments/waves/p13-2-completion-record.scope.json"
  ],
  "declared": {
    "actions": [],
    "backends": [],
    "surfaces": [
      "architecture_docs",
      "docs",
      "wave_scope"
    ],
    "instruments": [
      "access_point_docs",
      "architecture_spec",
      "binding_manifest"
    ],
    "control_planes": [
      "evaluator"
    ]
  },
  "required_scenarios": [
    "preservation.action_reward",
    "preservation.authority_belief_denial",
    "preservation.expired_authority",
    "preservation.explanation_trace",
    "preservation.frontier_normal",
    "preservation.frontier_timeout",
    "preservation.missing_belief_evidence",
    "preservation.provider_commit",
    "preservation.provider_conflict",
    "preservation.provider_rollback",
    "preservation.restart_restore",
    "target.binding_manifest_affectedness",
    "target.binding_manifest_protected_path_rejection",
    "target.binding_manifest_signature",
    "target.instrument_mutation_rejection",
    "target.promotion_override_rejection"
  ],
  "old_producer": null,
  "new_producer": null,
  "live_legs": []
}
