{
  "wave_scope_schema_version": "p13_wave_scope.v1",
  "declared_paths": [
    "calendar-pilot-p12/Makefile",
    "calendar-pilot-p12/evals/dogfood/capture/normalize_d1.py",
    "calendar-pilot-p12/evals/dogfood/predicates/product.py",
    "calendar-pilot-p12/experiments/waves/p13-dogfood-d5-live-read.scope.json",
    "calendar-pilot-p12/scripts/browser_dogfood_d1.mjs",
    "calendar-pilot-p12/scripts/prepare_p13_dogfood_run.py",
    "calendar-pilot-p12/scripts/run_p13_dogfood_d1.py",
    "calendar-pilot-p12/src/calendar_pilot/frontend/session.py",
    "calendar-pilot-p12/src/calendar_pilot/frontend/session_persistence.py",
    "calendar-pilot-p12/src/calendar_pilot/providers/apple_eventkit.py",
    "calendar-pilot-p12/tests/test_apple_eventkit_provider.py",
    "calendar-pilot-p12/tests/test_dogfood_evals.py",
    "calendar-pilot-p12/tests/test_p13_noop_vertical.py",
    "calendar-pilot-p12/tests/test_prepare_p13_dogfood_run.py",
    "compression-roadmap.md",
    "p13-dogfood.md"
  ],
  "declared": {
    "actions": [],
    "backends": ["apple_eventkit", "swift_ipc"],
    "surfaces": ["browser", "frontend", "projection", "replay"],
    "instruments": ["dogfood_capture_driver", "dogfood_normalizer", "dogfood_operator_truth", "tests"],
    "control_planes": ["eventkit_permission"]
  },
  "required_scenarios": [
    "preservation.action_reward",
    "preservation.authority_belief_denial",
    "preservation.expired_authority",
    "preservation.explanation_trace",
    "preservation.frontier_normal",
    "preservation.frontier_timeout",
    "preservation.missing_belief_evidence",
    "preservation.provider_commit",
    "preservation.provider_conflict",
    "preservation.provider_rollback",
    "preservation.restart_restore",
    "target.binding_manifest_affectedness",
    "target.binding_manifest_signature",
    "target.cited_required_projection",
    "target.product_core_no_effect_reachability",
    "target.reducer_determinism"
  ],
  "old_producer": null,
  "new_producer": null,
  "live_legs": []
}
