{
  "wave_scope_schema_version": "p13_wave_scope.v1",
  "declared_paths": [
    "calendar-pilot-p12/configs/p13_instrument_artifacts.json",
    "calendar-pilot-p12/evals/architecture/adapters/p13_current.py",
    "calendar-pilot-p12/evals/architecture/adapters/p13_eventkit_retirement_scenarios.py",
    "calendar-pilot-p12/experiments/waves/p13-eventkit-retirement-adapter-instrument.scope.json",
    "calendar-pilot-p12/tests/test_architecture_evals_v2.py"
  ],
  "declared": {
    "actions": ["*"],
    "backends": ["*"],
    "surfaces": ["configuration", "evaluation", "tests", "wave_scope"],
    "instruments": ["architecture_eval", "binding_manifest", "configuration", "tests"],
    "control_planes": ["effect_tcb", "evaluator", "optimizer"]
  },
  "required_scenarios": [
    "preservation.action_reward",
    "preservation.authority_belief_denial",
    "preservation.expired_authority",
    "preservation.explanation_trace",
    "preservation.frontier_normal",
    "preservation.frontier_timeout",
    "preservation.missing_belief_evidence",
    "preservation.provider_commit",
    "preservation.provider_conflict",
    "preservation.provider_rollback",
    "preservation.restart_restore",
    "target.binding_manifest_affectedness",
    "target.binding_manifest_protected_path_rejection",
    "target.binding_manifest_signature",
    "target.instrument_mutation_rejection",
    "target.promotion_override_rejection"
  ],
  "old_producer": {
    "cvar": {"producer_id": "cvar.before.current", "command": ["python3", "scripts/produce_cvar_frontier.py", "--role", "before", "--current", "experiments/promoted/CURRENT.json"]},
    "b_migrate": {"producer_id": "b_migrate.old.frontend_snapshot", "command": ["python3", "scripts/produce_b_migrate_old.py"]}
  },
  "new_producer": {
    "cvar": {"producer_id": "cvar.after.current", "command": ["python3", "scripts/produce_cvar_frontier.py", "--role", "after", "--current", "experiments/promoted/CURRENT.json"]},
    "b_migrate": {"producer_id": "b_migrate.new.frontend_projector", "command": ["python3", "scripts/produce_b_migrate_new.py"]}
  },
  "live_legs": []
}
